{
  "meta": {
    "charity_name": "Exemplar Aid Foundation",
    "financial_year_end": "2023-12-31"
  },
  "governance": {
    "board_structure": {
      "size": 3,
      "remuneration_disclosed": true
    },
    "lsg_compliance": {
      "is_lsg_compliant": true
    }
  },
  "financials": {
    "income": {
      "total": 1200000
    },
    "expenditure": {
      "total": 1000000,
      "program_services": 850000,
      "fundraising": 50000,
      "administration": 100000
    },
    "lsg_specific": {
      "lsg_reserve_amount": 200000
    },
    "ratio_inputs": {
      "net_current_assets": 400000,
      "monthly_operating_expenses": 83333.33
    }
  },
  "impact": {
    "scale": {
      "beneficiaries_count": 5000,
      "geographic_scope": "District"
    },
    "evidence_quality": "Pre-Post",
    "transparency": {
      "reports_publicly_available": true
    }
  },
  "audit_trail": [
    {
      "url": "https://example.com/annual_report_2023.pdf",
      "fetched_at": "2024-01-20T10:00:00Z",
      "snippet": "Total income for the year was $1,200,000."
    },
    {
      "url": "https://example.com/annual_report_2023.pdf",
      "fetched_at": "2024-01-20T10:00:00Z",
      "snippet": "Program services expenditure amounted to $850,000."
    },
    {
      "url": "https://example.com/annual_report_2023.pdf",
      "fetched_at": "2024-01-20T10:00:00Z",
      "snippet": "In 2023, our programs reached a total of 5,000 children across the district (p. 12)."
    }
  ]
}
